{
  "schemaVersion": 1,
  "language": "zh-CN",
  "tagNames": {
    "Gameplay": "玩法",
    "Utility": "工具",
    "Cosmetic": "装饰",
    "Library": "前置",
    "Expansion": "扩展",
    "Charm": "护符",
    "Joke": "整活",
    "Optimization": "优化",
    "Accessibility": "辅助",
    "Boss": "首领",
    "LLM-Assisted": "大语言模型辅助开发"
  },
  "mods": [
    {
      "id": "hkmod:Abskoth",
      "displayName": "绝对光辉与无敌马科斯",
      "description": "一个游戏模式，将无敌的马科斯添加到绝对光辉战斗中。"
    },
    {
      "id": "hkmod:AbsoluteZote",
      "displayName": "绝对左特",
      "description": "新的 GPZ mod boss。一起安装 AbsoluteZote 和 PureZote 以启用 AnyZote。"
    },
    {
      "id": "hkmod:AbsRad Configurable Attacks",
      "displayName": "AbsRad 可配置攻击",
      "description": "允许配置 Absolute Radiance 的攻击频率。同时适用于多个光辉。"
    },
    {
      "id": "hkmod:AbsRad Teleport Control",
      "displayName": "绝对光辉传送控制",
      "description": "允许在平台和绝对光辉战斗的最后阶段禁用传送位置。同时适用于多个光辉。"
    },
    {
      "id": "hkmod:AccessRandomizer",
      "displayName": "通行条件随机化",
      "description": "用于各种访问检查的随机机插件。"
    },
    {
      "id": "hkmod:AdBlocker",
      "displayName": "广告拦截",
      "description": "阻止广告"
    },
    {
      "id": "hkmod:Additional Challenge",
      "displayName": "额外挑战",
      "description": "该模组允许您使用 46 种不同的效果，让您的游戏更具挑战性。有 4 种类型的效果（持续、冷却、Boss 攻击、敌人跟随）可以从 mod 菜单启用。还有一种 choas 模式，可以随机选择周期性发生的效果。"
    },
    {
      "id": "hkmod:Additional Timelines",
      "displayName": "额外时间线",
      "description": "在片尾字幕后向统计屏幕添加额外时间线。"
    },
    {
      "id": "hkmod:AdditionalMaps",
      "displayName": "附加地图",
      "description": "添加白宫和神殿地图。白宫的一张就在大房间的长椅旁边。神殿位于万神殿上方的长椅旁边。"
    },
    {
      "id": "hkmod:Ado Death Scream",
      "displayName": "阿多死亡尖叫",
      "description": "骑士死亡时，会改为播放 Ado 的尖叫。"
    },
    {
      "id": "hkmod:Afterimage Plus",
      "displayName": "残影增强",
      "description": "一个为骑士和敌人提供可定制残像的模组。"
    },
    {
      "id": "hkmod:All4Love",
      "displayName": "爱予众生",
      "description": "爱4全部。"
    },
    {
      "id": "hkmod:AllGrubRewardsAtOnce",
      "displayName": "一次领取毛虫奖励",
      "description": "Grubfather 一次性给出所有可用奖励。"
    },
    {
      "id": "hkmod:AllHallownestEnhanced",
      "displayName": "全圣巢强化",
      "description": "这是一个增强整个圣巢的模组。我花了2.5个月才完成。带你体验初见空洞骑士的喜悦。希望在SilkSong发布之前它能够成为一个很好的代餐。"
    },
    {
      "id": "hkmod:AlphabetRando",
      "displayName": "界面字母随机化",
      "description": "游戏本身 UI 中字母的随机机连接"
    },
    {
      "id": "hkmod:AlreadyEnoughPlayMaker",
      "displayName": "PlayMaker 状态机优化",
      "description": "PlayMaker FSM 的优化模组。"
    },
    {
      "id": "hkmod:Always Furious",
      "displayName": "始终狂怒",
      "description": "堕落者之怒在装备时始终处于激活状态"
    },
    {
      "id": "hkmod:AlwaysHazardRespawn",
      "displayName": "死亡后在机关重生点复活",
      "description": "死亡后始终在危险重生位置重生。"
    },
    {
      "id": "hkmod:AlwaysWorldSense",
      "displayName": "常驻世界感知",
      "description": "立即授予世界感知"
    },
    {
      "id": "hkmod:Ancient Aspid",
      "displayName": "远古阿斯匹德",
      "description": "空洞骑士的模组，为王国边缘添加了全新的、具有挑战性的boss战"
    },
    {
      "id": "hkmod:Another Location",
      "displayName": "另一个地点",
      "description": "为随机机新增一个地点；可能附带条款与限制。"
    },
    {
      "id": "hkmod:Any Radiance 3.0",
      "displayName": "任意辐射 3.0",
      "description": "任意辐射 3.0"
    },
    {
      "id": "hkmod:AnyZote",
      "displayName": "终极左特",
      "description": "有史以来最强大的 zote modded Boss。"
    },
    {
      "id": "hkmod:Arcade Knight",
      "displayName": "街机骑士",
      "description": "添加一些小游戏。"
    },
    {
      "id": "hkmod:Archipelago",
      "displayName": "群岛",
      "description": "可以玩群岛多世界系统。"
    },
    {
      "id": "hkmod:Archipelago Map Mod",
      "displayName": "Archipelago 随机地图",
      "description": "RandoMapMod 的转换，可与 Archipelago 多重世界随机机配合使用"
    },
    {
      "id": "hkmod:Architect",
      "displayName": "建筑师",
      "description": "空洞骑士关卡编辑器模组，可使用游戏内关卡编辑器和关卡共享器轻松制作和共享自定义关卡。"
    },
    {
      "id": "hkmod:ArchitectLegacy",
      "displayName": "Architect 旧版关卡编辑器",
      "description": "旧版本的Architect，空洞骑士关卡编辑器。"
    },
    {
      "id": "hkmod:Archiv",
      "displayName": "档案",
      "description": "教师档案中有问题"
    },
    {
      "id": "hkmod:AsciiCamera",
      "displayName": "字符画视图",
      "description": "将着色器应用于相机，使游戏输出为 ascii 字符。"
    },
    {
      "id": "hkmod:Aspid Queen",
      "displayName": "阿斯皮德女王",
      "description": "在众神殿中添加了一场原始的阿斯皮德 Boss 战。"
    },
    {
      "id": "hkmod:Aspidnest",
      "displayName": "阿斯匹德巢穴追击",
      "description": "添加了许多无法杀死的敌人，例如原始 Aspids、水晶猎人、Loodles、Mantis Petras、Hive Soldiers、Hive Guardians、Squits、Mossflies、Flukefeys 和 Lance Sentries，它们会在整个圣巢中跟随你。这个模组可以在这个模组的选项页面中根据您自己的喜好进行配置。"
    },
    {
      "id": "hkmod:AspyCompanion",
      "displayName": "阿斯匹德伙伴",
      "description": "用 Aspy 取代 Grimmchild。"
    },
    {
      "id": "hkmod:Asymmetric Knight",
      "displayName": "非对称骑士",
      "description": "一个自定义骑士插件，允许左看和右看的骑士精灵不同。添加要使用的 Knight_left.png、Sprint_left.png 和 Unn_left.png。"
    },
    {
      "id": "hkmod:AuraRad",
      "displayName": "光环光辉",
      "description": "无上辐光 Boss 模组。"
    },
    {
      "id": "hkmod:Backdash",
      "displayName": "后撤冲刺",
      "description": "允许玩家在游戏中使用 Backdash"
    },
    {
      "id": "hkmod:BaldurRngConfig",
      "displayName": "巴德尔随机配置",
      "description": "配置各种Elder Baldur设置"
    },
    {
      "id": "hkmod:BenchDeploy",
      "displayName": "长椅部署",
      "description": "使用控制器/键盘部署多工作台。 itemsync MapSyncMod 上的其他玩家长椅"
    },
    {
      "id": "hkmod:BenchRando",
      "displayName": "长椅随机化",
      "description": "Randomizer 4 附加组件，用于将长椅随机化到新位置，并随机化将长椅作为物品扭曲的能力。"
    },
    {
      "id": "hkmod:Benchwarp",
      "displayName": "长椅传送",
      "description": "用于选择和变形到工作台的Mod。还允许放置长椅和扭曲到房间过渡。"
    },
    {
      "id": "hkmod:BenchWarpFix",
      "displayName": "长椅传送卡死修复",
      "description": "当在没有长椅的场景中进行长椅变形时，软锁会让你陷入泥沼。可能不适用于有故障的运行。"
    },
    {
      "id": "hkmod:BenchwarpSpoilerCloak",
      "displayName": "长椅名称防剧透",
      "description": "Benchwarp 插件，可在菜单中隐藏尚未访问的工作台名称。"
    },
    {
      "id": "hkmod:Better Godhome Music",
      "displayName": "更好的Godhome音乐",
      "description": "用新的Godhome版本的Boss曲目（由我制作）取代了闹鬼的敌人"
    },
    {
      "id": "hkmod:Better Void Heart",
      "displayName": "更好的虚空之心",
      "description": "拾起虚空之心时保持王魂灵魂回复。"
    },
    {
      "id": "hkmod:BetterCrystalHeart",
      "displayName": "水晶之心增强",
      "description": "为水晶之心的伤害和充电时间增加协同作用和奖励。"
    },
    {
      "id": "hkmod:BetterModList",
      "displayName": "模组列表优化",
      "description": "可调整游戏内 Mod 列表的呈现形式。"
    },
    {
      "id": "hkmod:Biblically Accurate Lasers",
      "displayName": "圣经准确的激光器",
      "description": "在光辉和绝对光辉战斗中添加一些可配置的激光器。"
    },
    {
      "id": "hkmod:BingoAdvancedCustomGeneration",
      "displayName": "宾果自定义棋盘生成",
      "description": "允许使用 BingoSync 生成更复杂的棋盘的 mod"
    },
    {
      "id": "hkmod:BingoBoard",
      "displayName": "宾果棋盘",
      "description": "把宾果挑战面板直接显示在游戏内。"
    },
    {
      "id": "hkmod:BingoBoardReplay",
      "displayName": "宾果棋盘回放",
      "description": "宾果锦标赛组织者的模组，可在玩家出现流延迟时帮助重新流式传输游戏板。使用方法请参见 GitHub 自述文件。"
    },
    {
      "id": "hkmod:BingoGoalPack1",
      "displayName": "宾果目标包一",
      "description": "向 BingoSync 添加更多目标并包含新的棋盘类型"
    },
    {
      "id": "hkmod:BingoGoalPack2",
      "displayName": "宾果目标包二",
      "description": "为自定义 BingoSync 挑战添加了更细粒度的规范"
    },
    {
      "id": "hkmod:BingoGoalPackGrubDay",
      "displayName": "毛虫日宾果目标包",
      "description": "一个目标包，为 2026 年 Grub Day 宾吉活动添加了 6 个新目标的自动标记"
    },
    {
      "id": "hkmod:BingoGoalPackSpleengy",
      "displayName": "Spleengy 竞占宾果目标包",
      "description": "专为锁定格式设计的备用宾果球门包"
    },
    {
      "id": "hkmod:BingoSync",
      "displayName": "宾果自动标记同步",
      "description": "A Hollow Knight mod，可在 bingosync.com 上自动标记方块"
    },
    {
      "id": "hkmod:BingoSyncExtension",
      "displayName": "宾果同步扩展（已弃用）",
      "description": "以前用于向 BingoSync 添加额外的自动标记逻辑，现已弃用"
    },
    {
      "id": "hkmod:BingoUI",
      "displayName": "宾果进度界面",
      "description": "自动跟踪随机机和速通宾果比赛的宾果目标。"
    },
    {
      "id": "hkmod:BlindRadiance",
      "displayName": "战斗背景调暗",
      "description": "使选定场景中的背景变暗，以使前景对象更加明显。"
    },
    {
      "id": "hkmod:BlueSR_OST",
      "displayName": "BlueSR 改编原声",
      "description": "用 BlueSR 的版本替换 Greenpath、Fungal Wastes 和 Sealed Vessel 战斗中的音轨。"
    },
    {
      "id": "hkmod:Bomber Knight",
      "displayName": "轰炸机骑士",
      "description": "添加炸弹能力，以及一些新的护符和自定义“Boss”。"
    },
    {
      "id": "hkmod:Bonfire",
      "displayName": "篝火",
      "description": "《空洞骑士》中的升级系统，可提供更真实的《黑暗之魂》体验（众所周知的空洞骑士抄袭）。"
    },
    {
      "id": "hkmod:Boss Attacks",
      "displayName": "Boss 攻击",
      "description": "在众神殿中训练 Boss 战斗，对抗特定的 Boss 攻击等。"
    },
    {
      "id": "hkmod:BossLib",
      "displayName": "Boss 开发库",
      "description": "简化 Boss 制作的库；单独安装不会生效。"
    },
    {
      "id": "hkmod:BossStatueFramework",
      "displayName": "众神堂雕像框架",
      "description": "用于向众神殿添加自定义 Boss 雕像的库。"
    },
    {
      "id": "hkmod:BossSync",
      "displayName": "首领联机同步（已弃用）",
      "description": "此模组现已过时，因为其功能已实现到另一个模组（MapSyncMod）中。目前正在开发另一个模组，以完善 112% Coop APB 速度运行的一些内容，该模组将以“SpeedrunSync”的名称发布"
    },
    {
      "id": "hkmod:Breakable Wall Randomizer",
      "displayName": "可破坏墙壁随机化",
      "description": "用于可破坏墙壁的空洞骑士随机机附加组件。"
    },
    {
      "id": "hkmod:BrokeLocUtil",
      "displayName": "随机化不可达地点调试",
      "description": "用于授予无法访问的随机位置的调试扩展"
    },
    {
      "id": "hkmod:Broken Nail",
      "displayName": "断指甲",
      "description": "为 hk 的断指甲挑战添加新的保存模式"
    },
    {
      "id": "hkmod:Brothers of Battle",
      "displayName": "战斗兄弟",
      "description": "与被伟大的指甲师狡猾训练的兄弟战斗"
    },
    {
      "id": "hkmod:BugPrince",
      "displayName": "虫之王子",
      "description": "随机机 4 连接，将 Blue Prince 机制与 Hollow Knight 过渡随机机相结合。"
    },
    {
      "id": "hkmod:CabbyCodes",
      "displayName": "CabbyCodes 作弊菜单",